book,chunk_id,text,v,a,d,n_tokens,n_hits,coverage,valence_only,v01,a01,d01
Romeo and Juliet.clean,141,"What's in a name? That which we call a rose By any other name would smell as sweet; So Romeo would, were he not Romeo call'd, Retain that dear perfection which he owes Without that title. Romeo, doff thy name, And for thy name, which is no part of thee, Take all myself. ROMEO. I take thee at thy word. Call me but love, and I'll be new baptis'd; Henceforth I never will be Romeo. JULIET. What man art thou that, thus bescreen'd in night So stumblest on my counsel? ROMEO. By a name I know not how to tell thee who I am: My name, dear saint, is hateful to myself, Because it is an enemy to thee.",0.110013,-0.108013,0.009184,116,76,0.655172,0.110013,0.5550065,0.4459935,0.504592
Romeo and Juliet.clean,142,"word. Call me but love, and I'll be new baptis'd; Henceforth I never will be Romeo. JULIET. What man art thou that, thus bescreen'd in night So stumblest on my counsel? ROMEO. By a name I know not how to tell thee who I am: My name, dear saint, is hateful to myself, Because it is an enemy to thee. Had I it written, I would tear the word. JULIET. My ears have yet not drunk a hundred words Of thy tongue's utterance, yet I know the sound. Art thou not Romeo, and a Montague? ROMEO. Neither, fair maid, if either thee dislike. JULIET. How cam'st thou hither, tell me, and wherefore?",0.075029,-0.107779,-0.002971,110,68,0.618182,0.075029,0.5375145,0.4461105,0.4985145
Romeo and Juliet.clean,143,"myself, Because it is an enemy to thee. Had I it written, I would tear the word. JULIET. My ears have yet not drunk a hundred words Of thy tongue's utterance, yet I know the sound. Art thou not Romeo, and a Montague? ROMEO. Neither, fair maid, if either thee dislike. JULIET. How cam'st thou hither, tell me, and wherefore? The orchard walls are high and hard to climb, And the place death, considering who thou art, If any of my kinsmen find thee here. ROMEO. With love's light wings did I o'erperch these walls, For stony limits cannot hold love out, And what love can do, that dares love attempt: Therefore thy kinsmen are no stop to me. JULIET.",0.067493,-0.04952,-0.02784,118,75,0.635593,0.067493,0.5337465,0.47524,0.48608
Romeo and Juliet.clean,144,"The orchard walls are high and hard to climb, And the place death, considering who thou art, If any of my kinsmen find thee here. ROMEO. With love's light wings did I o'erperch these walls, For stony limits cannot hold love out, And what love can do, that dares love attempt: Therefore thy kinsmen are no stop to me. JULIET. If they do see thee, they will murder thee. ROMEO. Alack, there lies more peril in thine eye Than twenty of their swords. Look thou but sweet, And I am proof against their enmity. JULIET. I would not for the world they saw thee here. ROMEO.",0.037625,-0.023778,-0.013306,105,72,0.685714,0.037625,0.5188125,0.488111,0.493347
Romeo and Juliet.clean,145,"do, that dares love attempt: Therefore thy kinsmen are no stop to me. JULIET. If they do see thee, they will murder thee. ROMEO. Alack, there lies more peril in thine eye Than twenty of their swords. Look thou but sweet, And I am proof against their enmity. JULIET. I would not for the world they saw thee here. ROMEO. I have night's cloak to hide me from their eyes, And but thou love me, let them find me here. My life were better ended by their hate Than death prorogued, wanting of thy love. JULIET. By whose direction found'st thou out this place? ROMEO.",0.057627,-0.024013,-0.005453,104,75,0.721154,0.057627,0.5288135,0.4879935,0.4972735
Romeo and Juliet.clean,146,"against their enmity. JULIET. I would not for the world they saw thee here. ROMEO. I have night's cloak to hide me from their eyes, And but thou love me, let them find me here. My life were better ended by their hate Than death prorogued, wanting of thy love. JULIET. By whose direction found'st thou out this place? ROMEO. By love, that first did prompt me to enquire; He lent me counsel, and I lent him eyes. I am no pilot; yet wert thou as far As that vast shore wash'd with the farthest sea, I should adventure for such merchandise. JULIET.",0.078135,0.010068,0.053716,103,74,0.718447,0.078135,0.5390675,0.505034,0.526858
Romeo and Juliet.clean,147,"Than death prorogued, wanting of thy love. JULIET. By whose direction found'st thou out this place? ROMEO. By love, that first did prompt me to enquire; He lent me counsel, and I lent him eyes. I am no pilot; yet wert thou as far As that vast shore wash'd with the farthest sea, I should adventure for such merchandise. JULIET. Thou knowest the mask of night is on my face, Else would a maiden blush bepaint my cheek For that which thou hast heard me speak tonight. Fain would I dwell on form, fain, fain deny What I have spoke; but farewell compliment. Dost thou love me? I know thou wilt say Ay, And I will take thy word.",0.1156,-0.020976,0.014412,117,85,0.726496,0.1156,0.5578,0.489512,0.507206
Romeo and Juliet.clean,148,"JULIET. Thou knowest the mask of night is on my face, Else would a maiden blush bepaint my cheek For that which thou hast heard me speak tonight. Fain would I dwell on form, fain, fain deny What I have spoke; but farewell compliment. Dost thou love me? I know thou wilt say Ay, And I will take thy word. Yet, if thou swear'st, Thou mayst prove false. At lovers' perjuries, They say Jove laughs. O gentle Romeo, If thou dost love, pronounce it faithfully. Or if thou thinkest I am too quickly won, I'll frown and be perverse, and say thee nay, So thou wilt woo. But else, not for the world.",0.095405,-0.040127,-0.059949,110,79,0.718182,0.095405,0.5477025,0.4799365,0.4700255
Romeo and Juliet.clean,149,"Ay, And I will take thy word. Yet, if thou swear'st, Thou mayst prove false. At lovers' perjuries, They say Jove laughs. O gentle Romeo, If thou dost love, pronounce it faithfully. Or if thou thinkest I am too quickly won, I'll frown and be perverse, and say thee nay, So thou wilt woo. But else, not for the world. In truth, fair Montague, I am too fond; And therefore thou mayst think my 'haviour light: But trust me, gentleman, I'll prove more true Than those that have more cunning to be strange.",0.164508,-0.020846,0.014862,90,65,0.722222,0.164508,0.582254,0.489577,0.507431
Romeo and Juliet.clean,150,"if thou thinkest I am too quickly won, I'll frown and be perverse, and say thee nay, So thou wilt woo. But else, not for the world. In truth, fair Montague, I am too fond; And therefore thou mayst think my 'haviour light: But trust me, gentleman, I'll prove more true Than those that have more cunning to be strange. I should have been more strange, I must confess, But that thou overheard'st, ere I was 'ware, My true-love passion; therefore pardon me, And not impute this yielding to light love, Which the dark night hath so discovered. ROMEO. Lady, by yonder blessed moon I vow, That tips with silver all these fruit-tree tops,— JULIET.",0.162518,-0.040012,0.052795,112,83,0.741071,0.162518,0.581259,0.479994,0.5263975
Romeo and Juliet.clean,151,"more cunning to be strange. I should have been more strange, I must confess, But that thou overheard'st, ere I was 'ware, My true-love passion; therefore pardon me, And not impute this yielding to light love, Which the dark night hath so discovered. ROMEO. Lady, by yonder blessed moon I vow, That tips with silver all these fruit-tree tops,— JULIET. O swear not by the moon, th'inconstant moon, That monthly changes in her circled orb, Lest that thy love prove likewise variable. ROMEO. What shall I swear by? JULIET. Do not swear at all. Or if thou wilt, swear by thy gracious self, Which is the god of my idolatry, And I'll believe thee. ROMEO.",0.146342,-0.053114,0.057228,111,79,0.711712,0.146342,0.573171,0.473443,0.528614
Romeo and Juliet.clean,152,"all these fruit-tree tops,— JULIET. O swear not by the moon, th'inconstant moon, That monthly changes in her circled orb, Lest that thy love prove likewise variable. ROMEO. What shall I swear by? JULIET. Do not swear at all. Or if thou wilt, swear by thy gracious self, Which is the god of my idolatry, And I'll believe thee. ROMEO. If my heart's dear love,— JULIET. Well, do not swear. Although I joy in thee, I have no joy of this contract tonight; It is too rash, too unadvis'd, too sudden, Too like the lightning, which doth cease to be Ere one can say ""It lightens."" Sweet, good night.",0.116493,-0.079693,0.028387,106,75,0.707547,0.116493,0.5582465,0.4601535,0.5141935
Romeo and Juliet.clean,153,"is the god of my idolatry, And I'll believe thee. ROMEO. If my heart's dear love,— JULIET. Well, do not swear. Although I joy in thee, I have no joy of this contract tonight; It is too rash, too unadvis'd, too sudden, Too like the lightning, which doth cease to be Ere one can say ""It lightens."" Sweet, good night. This bud of love, by summer's ripening breath, May prove a beauteous flower when next we meet. Good night, good night. As sweet repose and rest Come to thy heart as that within my breast. ROMEO. O wilt thou leave me so unsatisfied? JULIET. What satisfaction canst thou have tonight? ROMEO. Th'exchange of thy love's faithful vow for mine. JULIET.",0.160326,-0.10407,0.001628,116,86,0.741379,0.160326,0.580163,0.447965,0.500814
Romeo and Juliet.clean,154,"This bud of love, by summer's ripening breath, May prove a beauteous flower when next we meet. Good night, good night. As sweet repose and rest Come to thy heart as that within my breast. ROMEO. O wilt thou leave me so unsatisfied? JULIET. What satisfaction canst thou have tonight? ROMEO. Th'exchange of thy love's faithful vow for mine. JULIET. I gave thee mine before thou didst request it; And yet I would it were to give again. ROMEO. Would'st thou withdraw it? For what purpose, love? JULIET. But to be frank and give it thee again.",0.160028,-0.129306,-0.032778,93,72,0.774194,0.160028,0.580014,0.435347,0.483611
Romeo and Juliet.clean,155,"wilt thou leave me so unsatisfied? JULIET. What satisfaction canst thou have tonight? ROMEO. Th'exchange of thy love's faithful vow for mine. JULIET. I gave thee mine before thou didst request it; And yet I would it were to give again. ROMEO. Would'st thou withdraw it? For what purpose, love? JULIET. But to be frank and give it thee again. And yet I wish but for the thing I have; My bounty is as boundless as the sea, My love as deep; the more I give to thee, The more I have, for both are infinite. I hear some noise within. Dear love, adieu. [_Nurse calls within._] Anon, good Nurse!—Sweet Montague be true.",0.170619,-0.083083,0.023048,111,84,0.756757,0.170619,0.5853095,0.4584585,0.511524
Romeo and Juliet.clean,156,"be frank and give it thee again. And yet I wish but for the thing I have; My bounty is as boundless as the sea, My love as deep; the more I give to thee, The more I have, for both are infinite. I hear some noise within. Dear love, adieu. [_Nurse calls within._] Anon, good Nurse!—Sweet Montague be true. Stay but a little, I will come again. [_Exit._] ROMEO. O blessed, blessed night. I am afeard, Being in night, all this is but a dream, Too flattering sweet to be substantial. Enter Juliet above. JULIET. Three words, dear Romeo, and good night indeed.",0.241532,-0.124104,0.046273,100,77,0.77,0.241532,0.620766,0.437948,0.5231365
Romeo and Juliet.clean,157,"hear some noise within. Dear love, adieu. [_Nurse calls within._] Anon, good Nurse!—Sweet Montague be true. Stay but a little, I will come again. [_Exit._] ROMEO. O blessed, blessed night. I am afeard, Being in night, all this is but a dream, Too flattering sweet to be substantial. Enter Juliet above. JULIET. Three words, dear Romeo, and good night indeed. If that thy bent of love be honourable, Thy purpose marriage, send me word tomorrow, By one that I'll procure to come to thee, Where and what time thou wilt perform the rite, And all my fortunes at thy foot I'll lay And follow thee my lord throughout the world. NURSE. [_Within._] Madam. JULIET.",0.214459,-0.127388,0.031212,109,85,0.779817,0.214459,0.6072295,0.43630599999999997,0.515606
Romeo and Juliet.clean,158,"dear Romeo, and good night indeed. If that thy bent of love be honourable, Thy purpose marriage, send me word tomorrow, By one that I'll procure to come to thee, Where and what time thou wilt perform the rite, And all my fortunes at thy foot I'll lay And follow thee my lord throughout the world. NURSE. [_Within._] Madam. JULIET. I come, anon.— But if thou meanest not well, I do beseech thee,— NURSE. [_Within._] Madam. JULIET. By and by I come— To cease thy strife and leave me to my grief. Tomorrow will I send. ROMEO. So thrive my soul,— JULIET. A thousand times good night. [_Exit._] ROMEO. A thousand times the worse, to want thy light.",0.093835,-0.103797,0.034089,110,79,0.718182,0.093835,0.5469175,0.4481015,0.5170445
Romeo and Juliet.clean,159,"Madam. JULIET. I come, anon.— But if thou meanest not well, I do beseech thee,— NURSE. [_Within._] Madam. JULIET. By and by I come— To cease thy strife and leave me to my grief. Tomorrow will I send. ROMEO. So thrive my soul,— JULIET. A thousand times good night. [_Exit._] ROMEO. A thousand times the worse, to want thy light. Love goes toward love as schoolboys from their books, But love from love, towards school with heavy looks. [_Retiring slowly._] Re-enter Juliet, above. JULIET. Hist! Romeo, hist! O for a falconer's voice To lure this tassel-gentle back again.",0.08475,-0.074969,0.013016,96,64,0.666667,0.08475,0.542375,0.4625155,0.506508
Romeo and Juliet.clean,160,"ROMEO. So thrive my soul,— JULIET. A thousand times good night. [_Exit._] ROMEO. A thousand times the worse, to want thy light. Love goes toward love as schoolboys from their books, But love from love, towards school with heavy looks. [_Retiring slowly._] Re-enter Juliet, above. JULIET. Hist! Romeo, hist! O for a falconer's voice To lure this tassel-gentle back again. Bondage is hoarse and may not speak aloud, Else would I tear the cave where Echo lies, And make her airy tongue more hoarse than mine With repetition of my Romeo's name. ROMEO. It is my soul that calls upon my name. How silver-sweet sound lovers' tongues by night, Like softest music to attending ears. JULIET. Romeo. ROMEO. My dear?",0.157868,-0.066408,-0.007329,119,76,0.638655,0.157868,0.5789340000000001,0.466796,0.4963355
Romeo and Juliet.clean,161,"Bondage is hoarse and may not speak aloud, Else would I tear the cave where Echo lies, And make her airy tongue more hoarse than mine With repetition of my Romeo's name. ROMEO. It is my soul that calls upon my name. How silver-sweet sound lovers' tongues by night, Like softest music to attending ears. JULIET. Romeo. ROMEO. My dear? JULIET. What o'clock tomorrow Shall I send to thee? ROMEO. By the hour of nine. JULIET. I will not fail. 'Tis twenty years till then. I have forgot why I did call thee back. ROMEO. Let me stand here till thou remember it. JULIET. I shall forget, to have thee still stand there, Remembering how I love thy company. ROMEO.",0.094432,-0.127074,-0.087086,119,81,0.680672,0.094432,0.547216,0.436463,0.456457
Romeo and Juliet.clean,162,"JULIET. What o'clock tomorrow Shall I send to thee? ROMEO. By the hour of nine. JULIET. I will not fail. 'Tis twenty years till then. I have forgot why I did call thee back. ROMEO. Let me stand here till thou remember it. JULIET. I shall forget, to have thee still stand there, Remembering how I love thy company. ROMEO. And I'll still stay, to have thee still forget, Forgetting any other home but this.",0.0724,-0.199,-0.144,74,55,0.743243,0.0724,0.5362,0.40049999999999997,0.428
Romeo and Juliet.clean,163,"JULIET. I will not fail. 'Tis twenty years till then. I have forgot why I did call thee back. ROMEO. Let me stand here till thou remember it. JULIET. I shall forget, to have thee still stand there, Remembering how I love thy company. ROMEO. And I'll still stay, to have thee still forget, Forgetting any other home but this. JULIET. 'Tis almost morning; I would have thee gone, And yet no farther than a wanton's bird, That lets it hop a little from her hand, Like a poor prisoner in his twisted gyves, And with a silk thread plucks it back again, So loving-jealous of his liberty. ROMEO. I would I were thy bird. JULIET.",0.048154,-0.176692,-0.147423,114,78,0.684211,0.048154,0.524077,0.411654,0.4262885
Romeo and Juliet.clean,164,"other home but this. JULIET. 'Tis almost morning; I would have thee gone, And yet no farther than a wanton's bird, That lets it hop a little from her hand, Like a poor prisoner in his twisted gyves, And with a silk thread plucks it back again, So loving-jealous of his liberty. ROMEO. I would I were thy bird. JULIET. Sweet, so would I: Yet I should kill thee with much cherishing. Good night, good night. Parting is such sweet sorrow That I shall say good night till it be morrow. [_Exit._] ROMEO. Sleep dwell upon thine eyes, peace in thy breast. Would I were sleep and peace, so sweet to rest.",0.093623,-0.207792,-0.108455,108,77,0.712963,0.093623,0.5468115,0.396104,0.4457725
Romeo and Juliet.clean,165,"ROMEO. I would I were thy bird. JULIET. Sweet, so would I: Yet I should kill thee with much cherishing. Good night, good night. Parting is such sweet sorrow That I shall say good night till it be morrow. [_Exit._] ROMEO. Sleep dwell upon thine eyes, peace in thy breast. Would I were sleep and peace, so sweet to rest. Hence will I to my ghostly Sire's cell, His help to crave and my dear hap to tell. [_Exit._] SCENE III. Friar Lawrence's Cell. Enter Friar Lawrence with a basket. FRIAR LAWRENCE.",0.123516,-0.219047,-0.044625,89,64,0.719101,0.123516,0.561758,0.3904765,0.4776875
Romeo and Juliet.clean,166,"say good night till it be morrow. [_Exit._] ROMEO. Sleep dwell upon thine eyes, peace in thy breast. Would I were sleep and peace, so sweet to rest. Hence will I to my ghostly Sire's cell, His help to crave and my dear hap to tell. [_Exit._] SCENE III. Friar Lawrence's Cell. Enter Friar Lawrence with a basket. FRIAR LAWRENCE. The grey-ey'd morn smiles on the frowning night, Chequering the eastern clouds with streaks of light; And fleckled darkness like a drunkard reels From forth day's pathway, made by Titan's fiery wheels Now, ere the sun advance his burning eye, The day to cheer, and night's dank dew to dry, I must upfill this osier cage of ours With baleful weeds and precious-juiced flowers.",0.114607,-0.153202,-0.022337,125,89,0.712,0.114607,0.5573035,0.42339899999999997,0.4888315
Romeo and Juliet.clean,167,"on the frowning night, Chequering the eastern clouds with streaks of light; And fleckled darkness like a drunkard reels From forth day's pathway, made by Titan's fiery wheels Now, ere the sun advance his burning eye, The day to cheer, and night's dank dew to dry, I must upfill this osier cage of ours With baleful weeds and precious-juiced flowers. The earth that's nature's mother, is her tomb; What is her burying grave, that is her womb: And from her womb children of divers kind We sucking on her natural bosom find. Many for many virtues excellent, None but for some, and yet all different.",0.074764,-0.043528,0.026236,103,72,0.699029,0.074764,0.537382,0.478236,0.513118
Romeo and Juliet.clean,168,"dry, I must upfill this osier cage of ours With baleful weeds and precious-juiced flowers. The earth that's nature's mother, is her tomb; What is her burying grave, that is her womb: And from her womb children of divers kind We sucking on her natural bosom find. Many for many virtues excellent, None but for some, and yet all different. O, mickle is the powerful grace that lies In plants, herbs, stones, and their true qualities. For naught so vile that on the earth doth live But to the earth some special good doth give; Nor aught so good but, strain'd from that fair use, Revolts from true birth, stumbling on abuse.",0.118618,-0.073961,0.060421,109,76,0.697248,0.118618,0.5593090000000001,0.46301950000000003,0.5302105
Romeo and Juliet.clean,169,"None but for some, and yet all different. O, mickle is the powerful grace that lies In plants, herbs, stones, and their true qualities. For naught so vile that on the earth doth live But to the earth some special good doth give; Nor aught so good but, strain'd from that fair use, Revolts from true birth, stumbling on abuse. Virtue itself turns vice being misapplied, And vice sometime's by action dignified. Enter Romeo. Within the infant rind of this weak flower Poison hath residence, and medicine power: For this, being smelt, with that part cheers each part; Being tasted, slays all senses with the heart.",0.149039,-0.045299,0.062662,103,77,0.747573,0.149039,0.5745195,0.4773505,0.531331
Romeo and Juliet.clean,170,"good but, strain'd from that fair use, Revolts from true birth, stumbling on abuse. Virtue itself turns vice being misapplied, And vice sometime's by action dignified. Enter Romeo. Within the infant rind of this weak flower Poison hath residence, and medicine power: For this, being smelt, with that part cheers each part; Being tasted, slays all senses with the heart. Two such opposed kings encamp them still In man as well as herbs,—grace and rude will; And where the worser is predominant, Full soon the canker death eats up that plant. ROMEO. Good morrow, father. FRIAR LAWRENCE. Benedicite! What early tongue so sweet saluteth me?",0.128039,-0.058844,0.051623,104,77,0.740385,0.128039,0.5640195,0.470578,0.5258115
Romeo and Juliet.clean,171,"smelt, with that part cheers each part; Being tasted, slays all senses with the heart. Two such opposed kings encamp them still In man as well as herbs,—grace and rude will; And where the worser is predominant, Full soon the canker death eats up that plant. ROMEO. Good morrow, father. FRIAR LAWRENCE. Benedicite! What early tongue so sweet saluteth me? Young son, it argues a distemper'd head So soon to bid good morrow to thy bed. Care keeps his watch in every old man's eye, And where care lodges sleep will never lie; But where unbruised youth with unstuff'd brain Doth couch his limbs, there golden sleep doth reign.",0.189068,-0.14626,0.041575,109,73,0.669725,0.189068,0.594534,0.42686999999999997,0.5207875
Romeo and Juliet.clean,172,"father. FRIAR LAWRENCE. Benedicite! What early tongue so sweet saluteth me? Young son, it argues a distemper'd head So soon to bid good morrow to thy bed. Care keeps his watch in every old man's eye, And where care lodges sleep will never lie; But where unbruised youth with unstuff'd brain Doth couch his limbs, there golden sleep doth reign. Therefore thy earliness doth me assure Thou art uprous'd with some distemperature; Or if not so, then here I hit it right, Our Romeo hath not been in bed tonight. ROMEO. That last is true; the sweeter rest was mine. FRIAR LAWRENCE. God pardon sin. Wast thou with Rosaline? ROMEO. With Rosaline, my ghostly father? No.",0.194225,-0.167211,0.038014,113,71,0.628319,0.194225,0.5971125,0.4163945,0.519007
Romeo and Juliet.clean,173,"golden sleep doth reign. Therefore thy earliness doth me assure Thou art uprous'd with some distemperature; Or if not so, then here I hit it right, Our Romeo hath not been in bed tonight. ROMEO. That last is true; the sweeter rest was mine. FRIAR LAWRENCE. God pardon sin. Wast thou with Rosaline? ROMEO. With Rosaline, my ghostly father? No. I have forgot that name, and that name's woe. FRIAR LAWRENCE. That's my good son. But where hast thou been then? ROMEO. I'll tell thee ere thou ask it me again. I have been feasting with mine enemy, Where on a sudden one hath wounded me That's by me wounded. Both our remedies Within thy help and holy physic lies.",0.087309,-0.118247,-0.002901,116,81,0.698276,0.087309,0.5436545,0.4408765,0.4985495
Romeo and Juliet.clean,174,"I have forgot that name, and that name's woe. FRIAR LAWRENCE. That's my good son. But where hast thou been then? ROMEO. I'll tell thee ere thou ask it me again. I have been feasting with mine enemy, Where on a sudden one hath wounded me That's by me wounded. Both our remedies Within thy help and holy physic lies. I bear no hatred, blessed man; for lo, My intercession likewise steads my foe. FRIAR LAWRENCE. Be plain, good son, and homely in thy drift; Riddling confession finds but riddling shrift. ROMEO. Then plainly know my heart's dear love is set On the fair daughter of rich Capulet.",0.105114,-0.094214,-0.0178,106,70,0.660377,0.105114,0.552557,0.452893,0.4911
Romeo and Juliet.clean,175,"me wounded. Both our remedies Within thy help and holy physic lies. I bear no hatred, blessed man; for lo, My intercession likewise steads my foe. FRIAR LAWRENCE. Be plain, good son, and homely in thy drift; Riddling confession finds but riddling shrift. ROMEO. Then plainly know my heart's dear love is set On the fair daughter of rich Capulet. As mine on hers, so hers is set on mine; And all combin'd, save what thou must combine By holy marriage. When, and where, and how We met, we woo'd, and made exchange of vow, I'll tell thee as we pass; but this I pray, That thou consent to marry us today. FRIAR LAWRENCE. Holy Saint Francis!",0.189892,-0.077313,0.044361,113,83,0.734513,0.189892,0.594946,0.4613435,0.5221805
Romeo and Juliet.clean,176,"of rich Capulet. As mine on hers, so hers is set on mine; And all combin'd, save what thou must combine By holy marriage. When, and where, and how We met, we woo'd, and made exchange of vow, I'll tell thee as we pass; but this I pray, That thou consent to marry us today. FRIAR LAWRENCE. Holy Saint Francis! What a change is here! Is Rosaline, that thou didst love so dear, So soon forsaken? Young men's love then lies Not truly in their hearts, but in their eyes. Jesu Maria, what a deal of brine Hath wash'd thy sallow cheeks for Rosaline!",0.181851,-0.044,0.03573,101,74,0.732673,0.181851,0.5909255,0.478,0.517865
