book,chunk_id,text,v,a,d,n_tokens,n_hits,coverage,valence_only,v01,a01,d01
Romeo and Juliet.clean,250,"carries it away. Tybalt, you rat-catcher, will you walk? TYBALT. What wouldst thou have with me? MERCUTIO. Good King of Cats, nothing but one of your nine lives; that I mean to make bold withal, and, as you shall use me hereafter, dry-beat the rest of the eight. Will you pluck your sword out of his pilcher by the ears? Make haste, lest mine be about your ears ere it be out. TYBALT. [_Drawing._] I am for you. ROMEO. Gentle Mercutio, put thy rapier up. MERCUTIO. Come, sir, your passado. [_They fight._] ROMEO. Draw, Benvolio; beat down their weapons. Gentlemen, for shame, forbear this outrage, Tybalt, Mercutio, the Prince expressly hath Forbid this bandying in Verona streets. Hold, Tybalt!",0.04461,-0.074688,0.048597,116,77,0.663793,0.04461,0.522305,0.462656,0.5242985
Romeo and Juliet.clean,251,"ears? Make haste, lest mine be about your ears ere it be out. TYBALT. [_Drawing._] I am for you. ROMEO. Gentle Mercutio, put thy rapier up. MERCUTIO. Come, sir, your passado. [_They fight._] ROMEO. Draw, Benvolio; beat down their weapons. Gentlemen, for shame, forbear this outrage, Tybalt, Mercutio, the Prince expressly hath Forbid this bandying in Verona streets. Hold, Tybalt! Good Mercutio! [_Exeunt Tybalt with his Partizans._] MERCUTIO. I am hurt. A plague o' both your houses. I am sped. Is he gone, and hath nothing? BENVOLIO. What, art thou hurt? MERCUTIO. Ay, ay, a scratch, a scratch. Marry, 'tis enough. Where is my page? Go villain, fetch a surgeon. [_Exit Page._] ROMEO. Courage, man; the hurt cannot be much.",-0.022,0.019863,0.021329,117,73,0.623932,-0.022,0.489,0.5099315,0.5106645
Romeo and Juliet.clean,252,"Good Mercutio! [_Exeunt Tybalt with his Partizans._] MERCUTIO. I am hurt. A plague o' both your houses. I am sped. Is he gone, and hath nothing? BENVOLIO. What, art thou hurt? MERCUTIO. Ay, ay, a scratch, a scratch. Marry, 'tis enough. Where is my page? Go villain, fetch a surgeon. [_Exit Page._] ROMEO. Courage, man; the hurt cannot be much. MERCUTIO. No, 'tis not so deep as a well, nor so wide as a church door, but 'tis enough, 'twill serve. Ask for me tomorrow, and you shall find me a grave man. I am peppered, I warrant, for this world. A plague o' both your houses.",-0.027887,-0.031032,-0.032387,106,62,0.584906,-0.027887,0.4860565,0.484484,0.48380650000000003
Romeo and Juliet.clean,253,"fetch a surgeon. [_Exit Page._] ROMEO. Courage, man; the hurt cannot be much. MERCUTIO. No, 'tis not so deep as a well, nor so wide as a church door, but 'tis enough, 'twill serve. Ask for me tomorrow, and you shall find me a grave man. I am peppered, I warrant, for this world. A plague o' both your houses. Zounds, a dog, a rat, a mouse, a cat, to scratch a man to death. A braggart, a rogue, a villain, that fights by the book of arithmetic!—Why the devil came you between us? I was hurt under your arm. ROMEO. I thought all for the best. MERCUTIO. Help me into some house, Benvolio, Or I shall faint.",-0.0325,-0.056721,-0.008015,115,68,0.591304,-0.0325,0.48375,0.4716395,0.4959925
Romeo and Juliet.clean,254,"your houses. Zounds, a dog, a rat, a mouse, a cat, to scratch a man to death. A braggart, a rogue, a villain, that fights by the book of arithmetic!—Why the devil came you between us? I was hurt under your arm. ROMEO. I thought all for the best. MERCUTIO. Help me into some house, Benvolio, Or I shall faint. A plague o' both your houses. They have made worms' meat of me. I have it, and soundly too. Your houses! [_Exeunt Mercutio and Benvolio._] ROMEO. This gentleman, the Prince's near ally, My very friend, hath got his mortal hurt In my behalf; my reputation stain'd With Tybalt's slander,—Tybalt, that an hour Hath been my cousin.",-0.015232,-0.014435,-0.003,114,69,0.605263,-0.015232,0.492384,0.4927825,0.4985
Romeo and Juliet.clean,255,"Or I shall faint. A plague o' both your houses. They have made worms' meat of me. I have it, and soundly too. Your houses! [_Exeunt Mercutio and Benvolio._] ROMEO. This gentleman, the Prince's near ally, My very friend, hath got his mortal hurt In my behalf; my reputation stain'd With Tybalt's slander,—Tybalt, that an hour Hath been my cousin. O sweet Juliet, Thy beauty hath made me effeminate And in my temper soften'd valour's steel. Re-enter Benvolio. BENVOLIO. O Romeo, Romeo, brave Mercutio's dead, That gallant spirit hath aspir'd the clouds, Which too untimely here did scorn the earth. ROMEO. This day's black fate on mo days doth depend; This but begins the woe others must end. Re-enter Tybalt.",0.047486,-0.010457,-0.011229,122,70,0.57377,0.047486,0.523743,0.4947715,0.4943855
Romeo and Juliet.clean,256,"O sweet Juliet, Thy beauty hath made me effeminate And in my temper soften'd valour's steel. Re-enter Benvolio. BENVOLIO. O Romeo, Romeo, brave Mercutio's dead, That gallant spirit hath aspir'd the clouds, Which too untimely here did scorn the earth. ROMEO. This day's black fate on mo days doth depend; This but begins the woe others must end. Re-enter Tybalt. BENVOLIO. Here comes the furious Tybalt back again. ROMEO. Again in triumph, and Mercutio slain? Away to heaven respective lenity, And fire-ey'd fury be my conduct now! Now, Tybalt, take the 'villain' back again That late thou gav'st me, for Mercutio's soul Is but a little way above our heads, Staying for thine to keep him company.",0.030851,0.011041,0.004054,118,74,0.627119,0.030851,0.5154255,0.5055205,0.502027
Romeo and Juliet.clean,257,"end. Re-enter Tybalt. BENVOLIO. Here comes the furious Tybalt back again. ROMEO. Again in triumph, and Mercutio slain? Away to heaven respective lenity, And fire-ey'd fury be my conduct now! Now, Tybalt, take the 'villain' back again That late thou gav'st me, for Mercutio's soul Is but a little way above our heads, Staying for thine to keep him company. Either thou or I, or both, must go with him. TYBALT. Thou wretched boy, that didst consort him here, Shalt with him hence. ROMEO. This shall determine that. [_They fight; Tybalt falls._] BENVOLIO. Romeo, away, be gone! The citizens are up, and Tybalt slain. Stand not amaz'd. The Prince will doom thee death If thou art taken.",-0.02957,0.000329,0.005722,116,79,0.681034,-0.02957,0.485215,0.5001645,0.502861
Romeo and Juliet.clean,258,"keep him company. Either thou or I, or both, must go with him. TYBALT. Thou wretched boy, that didst consort him here, Shalt with him hence. ROMEO. This shall determine that. [_They fight; Tybalt falls._] BENVOLIO. Romeo, away, be gone! The citizens are up, and Tybalt slain. Stand not amaz'd. The Prince will doom thee death If thou art taken. Hence, be gone, away! ROMEO. O, I am fortune's fool! BENVOLIO. Why dost thou stay? [_Exit Romeo._] Enter Citizens. FIRST CITIZEN. Which way ran he that kill'd Mercutio? Tybalt, that murderer, which way ran he? BENVOLIO. There lies that Tybalt. FIRST CITIZEN. Up, sir, go with me. I charge thee in the Prince's name obey.",0.021176,-0.033878,0.022959,113,74,0.654867,0.021176,0.510588,0.483061,0.5114795
Romeo and Juliet.clean,259,"death If thou art taken. Hence, be gone, away! ROMEO. O, I am fortune's fool! BENVOLIO. Why dost thou stay? [_Exit Romeo._] Enter Citizens. FIRST CITIZEN. Which way ran he that kill'd Mercutio? Tybalt, that murderer, which way ran he? BENVOLIO. There lies that Tybalt. FIRST CITIZEN. Up, sir, go with me. I charge thee in the Prince's name obey. Enter Prince, attended; Montague, Capulet, their Wives and others. PRINCE. Where are the vile beginners of this fray? BENVOLIO. O noble Prince, I can discover all The unlucky manage of this fatal brawl. There lies the man, slain by young Romeo, That slew thy kinsman, brave Mercutio. LADY CAPULET. Tybalt, my cousin! O my brother's child! O Prince! O husband!",0.094427,0.000333,0.059707,118,75,0.635593,0.094427,0.5472135,0.5001665,0.5298535
Romeo and Juliet.clean,260,"Enter Prince, attended; Montague, Capulet, their Wives and others. PRINCE. Where are the vile beginners of this fray? BENVOLIO. O noble Prince, I can discover all The unlucky manage of this fatal brawl. There lies the man, slain by young Romeo, That slew thy kinsman, brave Mercutio. LADY CAPULET. Tybalt, my cousin! O my brother's child! O Prince! O husband! O, the blood is spill'd Of my dear kinsman! Prince, as thou art true, For blood of ours shed blood of Montague. O cousin, cousin. PRINCE. Benvolio, who began this bloody fray? BENVOLIO. Tybalt, here slain, whom Romeo's hand did slay; Romeo, that spoke him fair, bid him bethink How nice the quarrel was, and urg'd withal Your high displeasure.",0.068975,0.049309,0.085963,119,81,0.680672,0.068975,0.5344875,0.5246545,0.5429815
Romeo and Juliet.clean,261,"O, the blood is spill'd Of my dear kinsman! Prince, as thou art true, For blood of ours shed blood of Montague. O cousin, cousin. PRINCE. Benvolio, who began this bloody fray? BENVOLIO. Tybalt, here slain, whom Romeo's hand did slay; Romeo, that spoke him fair, bid him bethink How nice the quarrel was, and urg'd withal Your high displeasure. All this uttered With gentle breath, calm look, knees humbly bow'd Could not take truce with the unruly spleen Of Tybalt, deaf to peace, but that he tilts With piercing steel at bold Mercutio's breast, Who, all as hot, turns deadly point to point, And, with a martial scorn, with one hand beats Cold death aside, and with the other sends It back to Tybalt, whose dexterity Retorts it.",0.017191,-0.023479,0.030457,128,94,0.734375,0.017191,0.5085955,0.4882605,0.5152285
Romeo and Juliet.clean,262,"humbly bow'd Could not take truce with the unruly spleen Of Tybalt, deaf to peace, but that he tilts With piercing steel at bold Mercutio's breast, Who, all as hot, turns deadly point to point, And, with a martial scorn, with one hand beats Cold death aside, and with the other sends It back to Tybalt, whose dexterity Retorts it. Romeo he cries aloud, 'Hold, friends! Friends, part!' and swifter than his tongue, His agile arm beats down their fatal points, And 'twixt them rushes; underneath whose arm An envious thrust from Tybalt hit the life Of stout Mercutio, and then Tybalt fled.",-0.004419,-0.007054,0.015473,102,74,0.72549,-0.004419,0.4977905,0.496473,0.5077365
Romeo and Juliet.clean,263,"beats Cold death aside, and with the other sends It back to Tybalt, whose dexterity Retorts it. Romeo he cries aloud, 'Hold, friends! Friends, part!' and swifter than his tongue, His agile arm beats down their fatal points, And 'twixt them rushes; underneath whose arm An envious thrust from Tybalt hit the life Of stout Mercutio, and then Tybalt fled. But by and by comes back to Romeo, Who had but newly entertain'd revenge, And to't they go like lightning; for, ere I Could draw to part them was stout Tybalt slain; And as he fell did Romeo turn and fly. This is the truth, or let Benvolio die. LADY CAPULET. He is a kinsman to the Montague.",0.029488,0.027024,0.012202,117,84,0.717949,0.029488,0.514744,0.513512,0.506101
Romeo and Juliet.clean,264,"Tybalt fled. But by and by comes back to Romeo, Who had but newly entertain'd revenge, And to't they go like lightning; for, ere I Could draw to part them was stout Tybalt slain; And as he fell did Romeo turn and fly. This is the truth, or let Benvolio die. LADY CAPULET. He is a kinsman to the Montague. Affection makes him false, he speaks not true. Some twenty of them fought in this black strife, And all those twenty could but kill one life. I beg for justice, which thou, Prince, must give; Romeo slew Tybalt, Romeo must not live. PRINCE. Romeo slew him, he slew Mercutio. Who now the price of his dear blood doth owe? MONTAGUE.",-0.006671,0.033929,0.062376,118,85,0.720339,-0.006671,0.4966645,0.5169645,0.531188
Romeo and Juliet.clean,265,"Affection makes him false, he speaks not true. Some twenty of them fought in this black strife, And all those twenty could but kill one life. I beg for justice, which thou, Prince, must give; Romeo slew Tybalt, Romeo must not live. PRINCE. Romeo slew him, he slew Mercutio. Who now the price of his dear blood doth owe? MONTAGUE. Not Romeo, Prince, he was Mercutio's friend; His fault concludes but what the law should end, The life of Tybalt. PRINCE. And for that offence Immediately we do exile him hence. I have an interest in your hate's proceeding, My blood for your rude brawls doth lie a-bleeding.",-0.059974,0.06675,0.125776,106,76,0.716981,-0.059974,0.470013,0.533375,0.562888
Romeo and Juliet.clean,266,"Mercutio. Who now the price of his dear blood doth owe? MONTAGUE. Not Romeo, Prince, he was Mercutio's friend; His fault concludes but what the law should end, The life of Tybalt. PRINCE. And for that offence Immediately we do exile him hence. I have an interest in your hate's proceeding, My blood for your rude brawls doth lie a-bleeding. But I'll amerce you with so strong a fine That you shall all repent the loss of mine. I will be deaf to pleading and excuses; Nor tears nor prayers shall purchase out abuses. Therefore use none. Let Romeo hence in haste, Else, when he is found, that hour is his last. Bear hence this body, and attend our will.",0.027756,0.008833,0.066564,119,78,0.655462,0.027756,0.513878,0.5044165,0.533282
Romeo and Juliet.clean,267,"But I'll amerce you with so strong a fine That you shall all repent the loss of mine. I will be deaf to pleading and excuses; Nor tears nor prayers shall purchase out abuses. Therefore use none. Let Romeo hence in haste, Else, when he is found, that hour is his last. Bear hence this body, and attend our will. Mercy but murders, pardoning those that kill. [_Exeunt._] SCENE II. A Room in Capulet's House. Enter Juliet. JULIET. Gallop apace, you fiery-footed steeds, Towards Phoebus' lodging. Such a waggoner As Phaeton would whip you to the west And bring in cloudy night immediately.",0.061258,-0.033387,0.024387,101,62,0.613861,0.061258,0.530629,0.48330649999999997,0.5121935
Romeo and Juliet.clean,268,"when he is found, that hour is his last. Bear hence this body, and attend our will. Mercy but murders, pardoning those that kill. [_Exeunt._] SCENE II. A Room in Capulet's House. Enter Juliet. JULIET. Gallop apace, you fiery-footed steeds, Towards Phoebus' lodging. Such a waggoner As Phaeton would whip you to the west And bring in cloudy night immediately. Spread thy close curtain, love-performing night, That runaway's eyes may wink, and Romeo Leap to these arms, untalk'd of and unseen. Lovers can see to do their amorous rites By their own beauties: or, if love be blind, It best agrees with night.",0.136542,-0.051375,0.018153,101,72,0.712871,0.136542,0.568271,0.4743125,0.5090765
Romeo and Juliet.clean,269,"Such a waggoner As Phaeton would whip you to the west And bring in cloudy night immediately. Spread thy close curtain, love-performing night, That runaway's eyes may wink, and Romeo Leap to these arms, untalk'd of and unseen. Lovers can see to do their amorous rites By their own beauties: or, if love be blind, It best agrees with night. Come, civil night, Thou sober-suited matron, all in black, And learn me how to lose a winning match, Play'd for a pair of stainless maidenhoods. Hood my unmann'd blood, bating in my cheeks, With thy black mantle, till strange love, grow bold, Think true love acted simple modesty.",0.17312,-0.07492,-0.001947,103,75,0.728155,0.17312,0.58656,0.46254,0.4990265
Romeo and Juliet.clean,270,"own beauties: or, if love be blind, It best agrees with night. Come, civil night, Thou sober-suited matron, all in black, And learn me how to lose a winning match, Play'd for a pair of stainless maidenhoods. Hood my unmann'd blood, bating in my cheeks, With thy black mantle, till strange love, grow bold, Think true love acted simple modesty. Come, night, come Romeo; come, thou day in night; For thou wilt lie upon the wings of night Whiter than new snow upon a raven's back.",0.177793,-0.134483,-0.012241,83,58,0.698795,0.177793,0.5888965,0.4327585,0.4938795
Romeo and Juliet.clean,271,"lose a winning match, Play'd for a pair of stainless maidenhoods. Hood my unmann'd blood, bating in my cheeks, With thy black mantle, till strange love, grow bold, Think true love acted simple modesty. Come, night, come Romeo; come, thou day in night; For thou wilt lie upon the wings of night Whiter than new snow upon a raven's back. Come gentle night, come loving black-brow'd night, Give me my Romeo, and when I shall die, Take him and cut him out in little stars, And he will make the face of heaven so fine That all the world will be in love with night, And pay no worship to the garish sun.",0.147987,-0.120887,-0.014863,110,80,0.727273,0.147987,0.5739935,0.4395565,0.4925685
Romeo and Juliet.clean,272,"than new snow upon a raven's back. Come gentle night, come loving black-brow'd night, Give me my Romeo, and when I shall die, Take him and cut him out in little stars, And he will make the face of heaven so fine That all the world will be in love with night, And pay no worship to the garish sun. O, I have bought the mansion of a love, But not possess'd it; and though I am sold, Not yet enjoy'd. So tedious is this day As is the night before some festival To an impatient child that hath new robes And may not wear them.",0.159145,-0.096526,-0.012776,103,76,0.737864,0.159145,0.5795725,0.451737,0.493612
Romeo and Juliet.clean,273,"will be in love with night, And pay no worship to the garish sun. O, I have bought the mansion of a love, But not possess'd it; and though I am sold, Not yet enjoy'd. So tedious is this day As is the night before some festival To an impatient child that hath new robes And may not wear them. O, here comes my Nurse, And she brings news, and every tongue that speaks But Romeo's name speaks heavenly eloquence. Enter Nurse, with cords. Now, Nurse, what news? What hast thou there? The cords that Romeo bid thee fetch? NURSE. Ay, ay, the cords. [_Throws them down._] JULIET. Ay me, what news? Why dost thou wring thy hands? NURSE.",0.129951,-0.005753,-0.025432,116,81,0.698276,0.129951,0.5649755,0.4971235,0.487284
Romeo and Juliet.clean,274,"them. O, here comes my Nurse, And she brings news, and every tongue that speaks But Romeo's name speaks heavenly eloquence. Enter Nurse, with cords. Now, Nurse, what news? What hast thou there? The cords that Romeo bid thee fetch? NURSE. Ay, ay, the cords. [_Throws them down._] JULIET. Ay me, what news? Why dost thou wring thy hands? NURSE. Ah, well-a-day, he's dead, he's dead, he's dead! We are undone, lady, we are undone. Alack the day, he's gone, he's kill'd, he's dead. JULIET. Can heaven be so envious? NURSE. Romeo can, Though heaven cannot. O Romeo, Romeo. Who ever would have thought it? Romeo! JULIET. What devil art thou, that dost torment me thus?",0.070493,-0.018013,-0.056893,118,75,0.635593,0.070493,0.5352465,0.49099349999999997,0.4715535
Romeo and Juliet.clean,275,"wring thy hands? NURSE. Ah, well-a-day, he's dead, he's dead, he's dead! We are undone, lady, we are undone. Alack the day, he's gone, he's kill'd, he's dead. JULIET. Can heaven be so envious? NURSE. Romeo can, Though heaven cannot. O Romeo, Romeo. Who ever would have thought it? Romeo! JULIET. What devil art thou, that dost torment me thus? This torture should be roar'd in dismal hell. Hath Romeo slain himself? Say thou but Ay, And that bare vowel I shall poison more Than the death-darting eye of cockatrice. I am not I if there be such an I; Or those eyes shut that make thee answer Ay. If he be slain, say Ay; or if not, No.",-0.046203,-0.045203,-0.094025,119,79,0.663866,-0.046203,0.4768985,0.4773985,0.4529875
Romeo and Juliet.clean,276,"thus? This torture should be roar'd in dismal hell. Hath Romeo slain himself? Say thou but Ay, And that bare vowel I shall poison more Than the death-darting eye of cockatrice. I am not I if there be such an I; Or those eyes shut that make thee answer Ay. If he be slain, say Ay; or if not, No. Brief sounds determine of my weal or woe. NURSE. I saw the wound, I saw it with mine eyes, God save the mark!—here on his manly breast. A piteous corse, a bloody piteous corse; Pale, pale as ashes, all bedaub'd in blood, All in gore-blood. I swounded at the sight. JULIET. O, break, my heart. Poor bankrout, break at once.",-0.088349,-0.052759,-0.079578,118,83,0.70339,-0.088349,0.4558255,0.4736205,0.460211
Romeo and Juliet.clean,277,"Brief sounds determine of my weal or woe. NURSE. I saw the wound, I saw it with mine eyes, God save the mark!—here on his manly breast. A piteous corse, a bloody piteous corse; Pale, pale as ashes, all bedaub'd in blood, All in gore-blood. I swounded at the sight. JULIET. O, break, my heart. Poor bankrout, break at once. To prison, eyes; ne'er look on liberty. Vile earth to earth resign; end motion here, And thou and Romeo press one heavy bier. NURSE. O Tybalt, Tybalt, the best friend I had. O courteous Tybalt, honest gentleman! That ever I should live to see thee dead. JULIET. What storm is this that blows so contrary?",0.003526,-0.078397,-0.025987,113,78,0.690265,0.003526,0.501763,0.4608015,0.4870065
Romeo and Juliet.clean,278,"Poor bankrout, break at once. To prison, eyes; ne'er look on liberty. Vile earth to earth resign; end motion here, And thou and Romeo press one heavy bier. NURSE. O Tybalt, Tybalt, the best friend I had. O courteous Tybalt, honest gentleman! That ever I should live to see thee dead. JULIET. What storm is this that blows so contrary? Is Romeo slaughter'd and is Tybalt dead? My dearest cousin, and my dearer lord? Then dreadful trumpet sound the general doom, For who is living, if those two are gone? NURSE. Tybalt is gone, and Romeo banished, Romeo that kill'd him, he is banished. JULIET. O God! Did Romeo's hand shed Tybalt's blood? NURSE.",0.02362,-0.030266,-0.012873,111,79,0.711712,0.02362,0.51181,0.484867,0.4935635
Romeo and Juliet.clean,279,"is this that blows so contrary? Is Romeo slaughter'd and is Tybalt dead? My dearest cousin, and my dearer lord? Then dreadful trumpet sound the general doom, For who is living, if those two are gone? NURSE. Tybalt is gone, and Romeo banished, Romeo that kill'd him, he is banished. JULIET. O God! Did Romeo's hand shed Tybalt's blood? NURSE. It did, it did; alas the day, it did. JULIET. O serpent heart, hid with a flowering face! Did ever dragon keep so fair a cave? Beautiful tyrant, fiend angelical, Dove-feather'd raven, wolvish-ravening lamb! Despised substance of divinest show! Just opposite to what thou justly seem'st, A damned saint, an honourable villain!",0.035346,0.024123,0.019852,114,81,0.710526,0.035346,0.517673,0.5120615,0.509926
Romeo and Juliet.clean,280,"God! Did Romeo's hand shed Tybalt's blood? NURSE. It did, it did; alas the day, it did. JULIET. O serpent heart, hid with a flowering face! Did ever dragon keep so fair a cave? Beautiful tyrant, fiend angelical, Dove-feather'd raven, wolvish-ravening lamb! Despised substance of divinest show! Just opposite to what thou justly seem'st, A damned saint, an honourable villain! O nature, what hadst thou to do in hell When thou didst bower the spirit of a fiend In mortal paradise of such sweet flesh? Was ever book containing such vile matter So fairly bound? O, that deceit should dwell In such a gorgeous palace. NURSE. There's no trust, No faith, no honesty in men.",0.038187,0.012125,0.092738,114,80,0.701754,0.038187,0.5190935,0.5060625,0.546369
Romeo and Juliet.clean,281,"damned saint, an honourable villain! O nature, what hadst thou to do in hell When thou didst bower the spirit of a fiend In mortal paradise of such sweet flesh? Was ever book containing such vile matter So fairly bound? O, that deceit should dwell In such a gorgeous palace. NURSE. There's no trust, No faith, no honesty in men. All perjur'd, All forsworn, all naught, all dissemblers. Ah, where's my man? Give me some aqua vitae. These griefs, these woes, these sorrows make me old. Shame come to Romeo. JULIET. Blister'd be thy tongue For such a wish! He was not born to shame.",0.000563,-0.036,0.080016,100,64,0.64,0.000563,0.5002815,0.482,0.540008
Romeo and Juliet.clean,282,"In such a gorgeous palace. NURSE. There's no trust, No faith, no honesty in men. All perjur'd, All forsworn, all naught, all dissemblers. Ah, where's my man? Give me some aqua vitae. These griefs, these woes, these sorrows make me old. Shame come to Romeo. JULIET. Blister'd be thy tongue For such a wish! He was not born to shame. Upon his brow shame is asham'd to sit; For 'tis a throne where honour may be crown'd Sole monarch of the universal earth. O, what a beast was I to chide at him! NURSE. Will you speak well of him that kill'd your cousin? JULIET. Shall I speak ill of him that is my husband?",0.040521,-0.067817,0.049704,110,71,0.645455,0.040521,0.5202605,0.4660915,0.524852
Romeo and Juliet.clean,283,"was not born to shame. Upon his brow shame is asham'd to sit; For 'tis a throne where honour may be crown'd Sole monarch of the universal earth. O, what a beast was I to chide at him! NURSE. Will you speak well of him that kill'd your cousin? JULIET. Shall I speak ill of him that is my husband? Ah, poor my lord, what tongue shall smooth thy name, When I thy three-hours' wife have mangled it? But wherefore, villain, didst thou kill my cousin? That villain cousin would have kill'd my husband. Back, foolish tears, back to your native spring, Your tributary drops belong to woe, Which you mistaking offer up to joy.",0.050578,-0.036337,-0.030614,112,83,0.741071,0.050578,0.525289,0.4818315,0.484693
