book,chunk_id,text,v,a,d,n_tokens,n_hits,coverage,valence_only,v01,a01,d01
Romeo and Juliet.clean,354,"whining mammet, in her fortune's tender, To answer, 'I'll not wed, I cannot love, I am too young, I pray you pardon me.' But, and you will not wed, I'll pardon you. Graze where you will, you shall not house with me. Look to't, think on't, I do not use to jest. Thursday is near; lay hand on heart, advise. And you be mine, I'll give you to my friend; And you be not, hang, beg, starve, die in the streets, For by my soul, I'll ne'er acknowledge thee, Nor what is mine shall never do thee good. Trust to't, bethink you, I'll not be forsworn. [_Exit._] JULIET.",0.08595,-0.1265,-0.010883,103,60,0.582524,0.08595,0.542975,0.43674999999999997,0.4945585
Romeo and Juliet.clean,355,"not use to jest. Thursday is near; lay hand on heart, advise. And you be mine, I'll give you to my friend; And you be not, hang, beg, starve, die in the streets, For by my soul, I'll ne'er acknowledge thee, Nor what is mine shall never do thee good. Trust to't, bethink you, I'll not be forsworn. [_Exit._] JULIET. Is there no pity sitting in the clouds, That sees into the bottom of my grief? O sweet my mother, cast me not away, Delay this marriage for a month, a week, Or, if you do not, make the bridal bed In that dim monument where Tybalt lies. LADY CAPULET. Talk not to me, for I'll not speak a word.",0.127959,-0.116493,-0.050808,116,73,0.62931,0.127959,0.5639795,0.4417535,0.474596
Romeo and Juliet.clean,356,"Is there no pity sitting in the clouds, That sees into the bottom of my grief? O sweet my mother, cast me not away, Delay this marriage for a month, a week, Or, if you do not, make the bridal bed In that dim monument where Tybalt lies. LADY CAPULET. Talk not to me, for I'll not speak a word. Do as thou wilt, for I have done with thee. [_Exit._] JULIET. O God! O Nurse, how shall this be prevented? My husband is on earth, my faith in heaven. How shall that faith return again to earth, Unless that husband send it me from heaven By leaving earth? Comfort me, counsel me.",0.138632,-0.122105,0.001421,108,76,0.703704,0.138632,0.569316,0.4389475,0.5007105
Romeo and Juliet.clean,357,"me, for I'll not speak a word. Do as thou wilt, for I have done with thee. [_Exit._] JULIET. O God! O Nurse, how shall this be prevented? My husband is on earth, my faith in heaven. How shall that faith return again to earth, Unless that husband send it me from heaven By leaving earth? Comfort me, counsel me. Alack, alack, that heaven should practise stratagems Upon so soft a subject as myself. What say'st thou? Hast thou not a word of joy? Some comfort, Nurse. NURSE. Faith, here it is. Romeo is banished; and all the world to nothing That he dares ne'er come back to challenge you. Or if he do, it needs must be by stealth.",0.126476,-0.088845,0.067988,114,84,0.736842,0.126476,0.563238,0.4555775,0.533994
Romeo and Juliet.clean,358,"Alack, alack, that heaven should practise stratagems Upon so soft a subject as myself. What say'st thou? Hast thou not a word of joy? Some comfort, Nurse. NURSE. Faith, here it is. Romeo is banished; and all the world to nothing That he dares ne'er come back to challenge you. Or if he do, it needs must be by stealth. Then, since the case so stands as now it doth, I think it best you married with the County. O, he's a lovely gentleman. Romeo's a dishclout to him. An eagle, madam, Hath not so green, so quick, so fair an eye As Paris hath.",0.13594,-0.052224,0.091224,101,67,0.663366,0.13594,0.56797,0.473888,0.545612
Romeo and Juliet.clean,359,"come back to challenge you. Or if he do, it needs must be by stealth. Then, since the case so stands as now it doth, I think it best you married with the County. O, he's a lovely gentleman. Romeo's a dishclout to him. An eagle, madam, Hath not so green, so quick, so fair an eye As Paris hath. Beshrew my very heart, I think you are happy in this second match, For it excels your first: or if it did not, Your first is dead, or 'twere as good he were, As living here and you no use of him. JULIET. Speakest thou from thy heart? NURSE. And from my soul too, Or else beshrew them both. JULIET.",0.140104,-0.045442,0.073455,116,77,0.663793,0.140104,0.570052,0.477279,0.5367275
Romeo and Juliet.clean,360,"Beshrew my very heart, I think you are happy in this second match, For it excels your first: or if it did not, Your first is dead, or 'twere as good he were, As living here and you no use of him. JULIET. Speakest thou from thy heart? NURSE. And from my soul too, Or else beshrew them both. JULIET. Amen. NURSE. What? JULIET. Well, thou hast comforted me marvellous much. Go in, and tell my lady I am gone, Having displeas'd my father, to Lawrence' cell, To make confession and to be absolv'd. NURSE. Marry, I will; and this is wisely done. [_Exit._] JULIET. Ancient damnation! O most wicked fiend!",0.134513,-0.01559,0.068808,109,78,0.715596,0.134513,0.5672565,0.492205,0.534404
Romeo and Juliet.clean,361,"my soul too, Or else beshrew them both. JULIET. Amen. NURSE. What? JULIET. Well, thou hast comforted me marvellous much. Go in, and tell my lady I am gone, Having displeas'd my father, to Lawrence' cell, To make confession and to be absolv'd. NURSE. Marry, I will; and this is wisely done. [_Exit._] JULIET. Ancient damnation! O most wicked fiend! Is it more sin to wish me thus forsworn, Or to dispraise my lord with that same tongue Which she hath prais'd him with above compare So many thousand times? Go, counsellor. Thou and my bosom henceforth shall be twain. I'll to the Friar to know his remedy.",0.107724,-0.067132,0.048211,104,76,0.730769,0.107724,0.553862,0.466434,0.5241055
Romeo and Juliet.clean,362,"this is wisely done. [_Exit._] JULIET. Ancient damnation! O most wicked fiend! Is it more sin to wish me thus forsworn, Or to dispraise my lord with that same tongue Which she hath prais'd him with above compare So many thousand times? Go, counsellor. Thou and my bosom henceforth shall be twain. I'll to the Friar to know his remedy. If all else fail, myself have power to die. [_Exit._] ACT IV SCENE I. Friar Lawrence's Cell. Enter Friar Lawrence and Paris. FRIAR LAWRENCE. On Thursday, sir? The time is very short. PARIS. My father Capulet will have it so; And I am nothing slow to slack his haste. FRIAR LAWRENCE. You say you do not know the lady's mind.",0.044476,-0.111146,0.05839,117,82,0.700855,0.044476,0.522238,0.444427,0.529195
Romeo and Juliet.clean,363,"If all else fail, myself have power to die. [_Exit._] ACT IV SCENE I. Friar Lawrence's Cell. Enter Friar Lawrence and Paris. FRIAR LAWRENCE. On Thursday, sir? The time is very short. PARIS. My father Capulet will have it so; And I am nothing slow to slack his haste. FRIAR LAWRENCE. You say you do not know the lady's mind. Uneven is the course; I like it not. PARIS. Immoderately she weeps for Tybalt's death, And therefore have I little talk'd of love; For Venus smiles not in a house of tears.",0.044268,-0.092214,0.029,90,56,0.622222,0.044268,0.522134,0.453893,0.5145
Romeo and Juliet.clean,364,"PARIS. My father Capulet will have it so; And I am nothing slow to slack his haste. FRIAR LAWRENCE. You say you do not know the lady's mind. Uneven is the course; I like it not. PARIS. Immoderately she weeps for Tybalt's death, And therefore have I little talk'd of love; For Venus smiles not in a house of tears. Now, sir, her father counts it dangerous That she do give her sorrow so much sway; And in his wisdom, hastes our marriage, To stop the inundation of her tears, Which, too much minded by herself alone, May be put from her by society. Now do you know the reason of this haste.",0.062549,-0.054394,0.032958,106,71,0.669811,0.062549,0.5312745,0.472803,0.516479
Romeo and Juliet.clean,365,"smiles not in a house of tears. Now, sir, her father counts it dangerous That she do give her sorrow so much sway; And in his wisdom, hastes our marriage, To stop the inundation of her tears, Which, too much minded by herself alone, May be put from her by society. Now do you know the reason of this haste. FRIAR LAWRENCE. [_Aside._] I would I knew not why it should be slow'd.— Look, sir, here comes the lady toward my cell. Enter Juliet. PARIS. Happily met, my lady and my wife! JULIET. That may be, sir, when I may be a wife. PARIS. That may be, must be, love, on Thursday next. JULIET. What must be shall be.",0.141,-0.096471,0.033588,114,85,0.745614,0.141,0.5705,0.4517645,0.516794
Romeo and Juliet.clean,366,"haste. FRIAR LAWRENCE. [_Aside._] I would I knew not why it should be slow'd.— Look, sir, here comes the lady toward my cell. Enter Juliet. PARIS. Happily met, my lady and my wife! JULIET. That may be, sir, when I may be a wife. PARIS. That may be, must be, love, on Thursday next. JULIET. What must be shall be. FRIAR LAWRENCE. That's a certain text. PARIS. Come you to make confession to this father? JULIET. To answer that, I should confess to you. PARIS. Do not deny to him that you love me. JULIET. I will confess to you that I love him. PARIS. So will ye, I am sure, that you love me. JULIET.",0.212658,-0.094079,0.059987,116,76,0.655172,0.212658,0.606329,0.4529605,0.5299935
Romeo and Juliet.clean,367,"must be shall be. FRIAR LAWRENCE. That's a certain text. PARIS. Come you to make confession to this father? JULIET. To answer that, I should confess to you. PARIS. Do not deny to him that you love me. JULIET. I will confess to you that I love him. PARIS. So will ye, I am sure, that you love me. JULIET. If I do so, it will be of more price, Being spoke behind your back than to your face. PARIS. Poor soul, thy face is much abus'd with tears. JULIET. The tears have got small victory by that; For it was bad enough before their spite. PARIS. Thou wrong'st it more than tears with that report. JULIET.",0.072087,-0.067413,0.008763,114,80,0.701754,0.072087,0.5360435,0.4662935,0.5043815
Romeo and Juliet.clean,368,"love me. JULIET. If I do so, it will be of more price, Being spoke behind your back than to your face. PARIS. Poor soul, thy face is much abus'd with tears. JULIET. The tears have got small victory by that; For it was bad enough before their spite. PARIS. Thou wrong'st it more than tears with that report. JULIET. That is no slander, sir, which is a truth, And what I spake, I spake it to my face. PARIS. Thy face is mine, and thou hast slander'd it. JULIET. It may be so, for it is not mine own. Are you at leisure, holy father, now, Or shall I come to you at evening mass? FRIAR LAWRENCE.",0.031864,-0.111284,-0.031309,112,81,0.723214,0.031864,0.5159320000000001,0.44435800000000003,0.4843455
Romeo and Juliet.clean,369,"report. JULIET. That is no slander, sir, which is a truth, And what I spake, I spake it to my face. PARIS. Thy face is mine, and thou hast slander'd it. JULIET. It may be so, for it is not mine own. Are you at leisure, holy father, now, Or shall I come to you at evening mass? FRIAR LAWRENCE. My leisure serves me, pensive daughter, now.— My lord, we must entreat the time alone. PARIS. God shield I should disturb devotion!— Juliet, on Thursday early will I rouse ye, Till then, adieu; and keep this holy kiss. [_Exit._] JULIET. O shut the door, and when thou hast done so, Come weep with me, past hope, past cure, past help!",0.085494,-0.140313,0.00606,116,83,0.715517,0.085494,0.542747,0.4298435,0.50303
Romeo and Juliet.clean,370,"My leisure serves me, pensive daughter, now.— My lord, we must entreat the time alone. PARIS. God shield I should disturb devotion!— Juliet, on Thursday early will I rouse ye, Till then, adieu; and keep this holy kiss. [_Exit._] JULIET. O shut the door, and when thou hast done so, Come weep with me, past hope, past cure, past help! FRIAR LAWRENCE. O Juliet, I already know thy grief; It strains me past the compass of my wits. I hear thou must, and nothing may prorogue it, On Thursday next be married to this County. JULIET. Tell me not, Friar, that thou hear'st of this, Unless thou tell me how I may prevent it.",0.06984,-0.129667,-0.012395,111,81,0.72973,0.06984,0.53492,0.4351665,0.4938025
Romeo and Juliet.clean,371,"past hope, past cure, past help! FRIAR LAWRENCE. O Juliet, I already know thy grief; It strains me past the compass of my wits. I hear thou must, and nothing may prorogue it, On Thursday next be married to this County. JULIET. Tell me not, Friar, that thou hear'st of this, Unless thou tell me how I may prevent it. If in thy wisdom, thou canst give no help, Do thou but call my resolution wise, And with this knife I'll help it presently.",0.08455,-0.11565,-0.00535,82,60,0.731707,0.08455,0.542275,0.442175,0.497325
Romeo and Juliet.clean,372,"I hear thou must, and nothing may prorogue it, On Thursday next be married to this County. JULIET. Tell me not, Friar, that thou hear'st of this, Unless thou tell me how I may prevent it. If in thy wisdom, thou canst give no help, Do thou but call my resolution wise, And with this knife I'll help it presently. God join'd my heart and Romeo's, thou our hands; And ere this hand, by thee to Romeo's seal'd, Shall be the label to another deed, Or my true heart with treacherous revolt Turn to another, this shall slay them both.",0.058413,-0.08532,0.004987,97,75,0.773196,0.058413,0.5292065,0.45734,0.5024935
Romeo and Juliet.clean,373,"thou canst give no help, Do thou but call my resolution wise, And with this knife I'll help it presently. God join'd my heart and Romeo's, thou our hands; And ere this hand, by thee to Romeo's seal'd, Shall be the label to another deed, Or my true heart with treacherous revolt Turn to another, this shall slay them both. Therefore, out of thy long-experienc'd time, Give me some present counsel, or behold 'Twixt my extremes and me this bloody knife Shall play the empire, arbitrating that Which the commission of thy years and art Could to no issue of true honour bring. Be not so long to speak.",0.062785,-0.050873,0.029316,106,79,0.745283,0.062785,0.5313925,0.4745635,0.514658
Romeo and Juliet.clean,374,"with treacherous revolt Turn to another, this shall slay them both. Therefore, out of thy long-experienc'd time, Give me some present counsel, or behold 'Twixt my extremes and me this bloody knife Shall play the empire, arbitrating that Which the commission of thy years and art Could to no issue of true honour bring. Be not so long to speak. I long to die, If what thou speak'st speak not of remedy. FRIAR LAWRENCE. Hold, daughter. I do spy a kind of hope, Which craves as desperate an execution As that is desperate which we would prevent.",-0.009957,0.002771,0.001286,92,70,0.76087,-0.009957,0.4950215,0.5013855,0.500643
Romeo and Juliet.clean,375,"that Which the commission of thy years and art Could to no issue of true honour bring. Be not so long to speak. I long to die, If what thou speak'st speak not of remedy. FRIAR LAWRENCE. Hold, daughter. I do spy a kind of hope, Which craves as desperate an execution As that is desperate which we would prevent. If, rather than to marry County Paris Thou hast the strength of will to slay thyself, Then is it likely thou wilt undertake A thing like death to chide away this shame, That cop'st with death himself to scape from it. And if thou dar'st, I'll give thee remedy. JULIET.",-0.0205,0.003202,-0.019321,104,84,0.807692,-0.0205,0.48975,0.501601,0.4903395
Romeo and Juliet.clean,376,"an execution As that is desperate which we would prevent. If, rather than to marry County Paris Thou hast the strength of will to slay thyself, Then is it likely thou wilt undertake A thing like death to chide away this shame, That cop'st with death himself to scape from it. And if thou dar'st, I'll give thee remedy. JULIET. O, bid me leap, rather than marry Paris, From off the battlements of yonder tower, Or walk in thievish ways, or bid me lurk Where serpents are. Chain me with roaring bears; Or hide me nightly in a charnel-house, O'er-cover'd quite with dead men's rattling bones, With reeky shanks and yellow chapless skulls.",-0.037241,0.026532,-0.017937,110,79,0.718182,-0.037241,0.4813795,0.513266,0.4910315
Romeo and Juliet.clean,377,"thou dar'st, I'll give thee remedy. JULIET. O, bid me leap, rather than marry Paris, From off the battlements of yonder tower, Or walk in thievish ways, or bid me lurk Where serpents are. Chain me with roaring bears; Or hide me nightly in a charnel-house, O'er-cover'd quite with dead men's rattling bones, With reeky shanks and yellow chapless skulls. Or bid me go into a new-made grave, And hide me with a dead man in his shroud; Things that, to hear them told, have made me tremble, And I will do it without fear or doubt, To live an unstain'd wife to my sweet love. FRIAR LAWRENCE. Hold then. Go home, be merry, give consent To marry Paris.",0.06668,-0.026667,-0.042667,116,75,0.646552,0.06668,0.53334,0.4866665,0.4786665
Romeo and Juliet.clean,378,"skulls. Or bid me go into a new-made grave, And hide me with a dead man in his shroud; Things that, to hear them told, have made me tremble, And I will do it without fear or doubt, To live an unstain'd wife to my sweet love. FRIAR LAWRENCE. Hold then. Go home, be merry, give consent To marry Paris. Wednesday is tomorrow; Tomorrow night look that thou lie alone, Let not thy Nurse lie with thee in thy chamber. Take thou this vial, being then in bed, And this distilled liquor drink thou off, When presently through all thy veins shall run A cold and drowsy humour; for no pulse Shall keep his native progress, but surcease.",0.075435,-0.038647,-0.055259,113,85,0.752212,0.075435,0.5377175,0.4806765,0.4723705
Romeo and Juliet.clean,379,"marry Paris. Wednesday is tomorrow; Tomorrow night look that thou lie alone, Let not thy Nurse lie with thee in thy chamber. Take thou this vial, being then in bed, And this distilled liquor drink thou off, When presently through all thy veins shall run A cold and drowsy humour; for no pulse Shall keep his native progress, but surcease. No warmth, no breath shall testify thou livest, The roses in thy lips and cheeks shall fade To paly ashes; thy eyes' windows fall, Like death when he shuts up the day of life. Each part depriv'd of supple government, Shall stiff and stark and cold appear like death.",0.03995,-0.0479,-0.047075,107,80,0.747664,0.03995,0.519975,0.47605,0.4764625
Romeo and Juliet.clean,380,"humour; for no pulse Shall keep his native progress, but surcease. No warmth, no breath shall testify thou livest, The roses in thy lips and cheeks shall fade To paly ashes; thy eyes' windows fall, Like death when he shuts up the day of life. Each part depriv'd of supple government, Shall stiff and stark and cold appear like death. And in this borrow'd likeness of shrunk death Thou shalt continue two and forty hours, And then awake as from a pleasant sleep. Now when the bridegroom in the morning comes To rouse thee from thy bed, there art thou dead.",0.032365,-0.09,-0.009959,100,74,0.74,0.032365,0.5161825,0.455,0.4950205
Romeo and Juliet.clean,381,"the day of life. Each part depriv'd of supple government, Shall stiff and stark and cold appear like death. And in this borrow'd likeness of shrunk death Thou shalt continue two and forty hours, And then awake as from a pleasant sleep. Now when the bridegroom in the morning comes To rouse thee from thy bed, there art thou dead. Then as the manner of our country is, In thy best robes, uncover'd, on the bier, Thou shalt be borne to that same ancient vault Where all the kindred of the Capulets lie.",0.050775,-0.102606,0.003803,91,71,0.78022,0.050775,0.5253875,0.448697,0.5019015
Romeo and Juliet.clean,382,"hours, And then awake as from a pleasant sleep. Now when the bridegroom in the morning comes To rouse thee from thy bed, there art thou dead. Then as the manner of our country is, In thy best robes, uncover'd, on the bier, Thou shalt be borne to that same ancient vault Where all the kindred of the Capulets lie. In the meantime, against thou shalt awake, Shall Romeo by my letters know our drift, And hither shall he come, and he and I Will watch thy waking, and that very night Shall Romeo bear thee hence to Mantua.",0.089986,-0.140229,0.0007,95,70,0.736842,0.089986,0.544993,0.42988550000000003,0.50035
Romeo and Juliet.clean,383,"uncover'd, on the bier, Thou shalt be borne to that same ancient vault Where all the kindred of the Capulets lie. In the meantime, against thou shalt awake, Shall Romeo by my letters know our drift, And hither shall he come, and he and I Will watch thy waking, and that very night Shall Romeo bear thee hence to Mantua. And this shall free thee from this present shame, If no inconstant toy nor womanish fear Abate thy valour in the acting it. JULIET. Give me, give me! O tell not me of fear! FRIAR LAWRENCE. Hold; get you gone, be strong and prosperous In this resolve.",0.119613,-0.093067,-0.018,103,75,0.728155,0.119613,0.5598065,0.4534665,0.491
Romeo and Juliet.clean,384,"thy waking, and that very night Shall Romeo bear thee hence to Mantua. And this shall free thee from this present shame, If no inconstant toy nor womanish fear Abate thy valour in the acting it. JULIET. Give me, give me! O tell not me of fear! FRIAR LAWRENCE. Hold; get you gone, be strong and prosperous In this resolve. I'll send a friar with speed To Mantua, with my letters to thy lord. JULIET. Love give me strength, and strength shall help afford. Farewell, dear father. [_Exeunt._] SCENE II. Hall in Capulet's House. Enter Capulet, Lady Capulet, Nurse and Servants. CAPULET. So many guests invite as here are writ. [_Exit first Servant._] Sirrah, go hire me twenty cunning cooks.",0.193346,-0.063821,0.009077,118,78,0.661017,0.193346,0.596673,0.4680895,0.5045385
Romeo and Juliet.clean,385,"I'll send a friar with speed To Mantua, with my letters to thy lord. JULIET. Love give me strength, and strength shall help afford. Farewell, dear father. [_Exeunt._] SCENE II. Hall in Capulet's House. Enter Capulet, Lady Capulet, Nurse and Servants. CAPULET. So many guests invite as here are writ. [_Exit first Servant._] Sirrah, go hire me twenty cunning cooks. SECOND SERVANT. You shall have none ill, sir; for I'll try if they can lick their fingers. CAPULET. How canst thou try them so? SECOND SERVANT. Marry, sir, 'tis an ill cook that cannot lick his own fingers; therefore he that cannot lick his fingers goes not with me. CAPULET.",0.144437,-0.072507,0.032789,109,71,0.651376,0.144437,0.5722185,0.4637465,0.5163945
Romeo and Juliet.clean,386,"[_Exit first Servant._] Sirrah, go hire me twenty cunning cooks. SECOND SERVANT. You shall have none ill, sir; for I'll try if they can lick their fingers. CAPULET. How canst thou try them so? SECOND SERVANT. Marry, sir, 'tis an ill cook that cannot lick his own fingers; therefore he that cannot lick his fingers goes not with me. CAPULET. Go, begone. [_Exit second Servant._] We shall be much unfurnish'd for this time. What, is my daughter gone to Friar Lawrence? NURSE. Ay, forsooth. CAPULET. Well, he may chance to do some good on her. A peevish self-will'd harlotry it is. Enter Juliet. NURSE. See where she comes from shrift with merry look. CAPULET. How now, my headstrong.",0.085393,-0.079083,-0.035226,117,84,0.717949,0.085393,0.5426965,0.4604585,0.482387
Romeo and Juliet.clean,387,"me. CAPULET. Go, begone. [_Exit second Servant._] We shall be much unfurnish'd for this time. What, is my daughter gone to Friar Lawrence? NURSE. Ay, forsooth. CAPULET. Well, he may chance to do some good on her. A peevish self-will'd harlotry it is. Enter Juliet. NURSE. See where she comes from shrift with merry look. CAPULET. How now, my headstrong. Where have you been gadding? JULIET. Where I have learnt me to repent the sin Of disobedient opposition To you and your behests; and am enjoin'd By holy Lawrence to fall prostrate here, To beg your pardon. Pardon, I beseech you. Henceforward I am ever rul'd by you. CAPULET. Send for the County, go tell him of this.",0.046095,-0.073155,-0.007917,117,84,0.717949,0.046095,0.5230475,0.4634225,0.4960415
Romeo and Juliet.clean,388,"my headstrong. Where have you been gadding? JULIET. Where I have learnt me to repent the sin Of disobedient opposition To you and your behests; and am enjoin'd By holy Lawrence to fall prostrate here, To beg your pardon. Pardon, I beseech you. Henceforward I am ever rul'd by you. CAPULET. Send for the County, go tell him of this. I'll have this knot knit up tomorrow morning. JULIET. I met the youthful lord at Lawrence' cell, And gave him what becomed love I might, Not stepping o'er the bounds of modesty. CAPULET. Why, I am glad on't. This is well. Stand up. This is as't should be. Let me see the County. Ay, marry.",0.096909,-0.042481,0.039896,113,77,0.681416,0.096909,0.5484545,0.4787595,0.519948
Romeo and Juliet.clean,389,"go tell him of this. I'll have this knot knit up tomorrow morning. JULIET. I met the youthful lord at Lawrence' cell, And gave him what becomed love I might, Not stepping o'er the bounds of modesty. CAPULET. Why, I am glad on't. This is well. Stand up. This is as't should be. Let me see the County. Ay, marry. Go, I say, and fetch him hither. Now afore God, this reverend holy Friar, All our whole city is much bound to him. JULIET. Nurse, will you go with me into my closet, To help me sort such needful ornaments As you think fit to furnish me tomorrow? LADY CAPULET. No, not till Thursday. There is time enough. CAPULET.",0.185976,-0.082059,0.047565,114,85,0.745614,0.185976,0.592988,0.4589705,0.5237825
